{
  "$ref": "#/definitions/subcategories",
  "definitions": {
    "subcategories": {
      "type": "object",
      "properties": {
        "name": {
          "type": "string"
        },
        "slug": {
          "type": "string"
        },
        "categorySlug": {
          "type": "string"
        },
        "description": {
          "type": "string"
        },
        "seoTitle": {
          "type": "string"
        },
        "seoDescription": {
          "type": "string"
        },
        "heroImage": {
          "type": "string"
        },
        "seoContent": {
          "type": "string"
        },
        "siblingLinks": {
          "type": "array",
          "items": {
            "type": "object",
            "properties": {
              "name": {
                "type": "string"
              },
              "slug": {
                "type": "string"
              }
            },
            "required": [
              "name",
              "slug"
            ],
            "additionalProperties": false
          }
        },
        "order": {
          "type": "number",
          "default": 0
        },
        "$schema": {
          "type": "string"
        }
      },
      "required": [
        "name",
        "slug",
        "categorySlug",
        "description",
        "seoTitle",
        "seoDescription"
      ],
      "additionalProperties": false
    }
  },
  "$schema": "http://json-schema.org/draft-07/schema#"
}